{
  "generated_at": "2026-10-15",
  "passed": 36,
  "total": 36,
  "checks": [
    {
      "name": "headline_current",
      "critical": true,
      "pass": true,
      "detail": "latest official print 2026-09-01 is 44d old (limit 80)"
    },
    {
      "name": "yoy_finite",
      "critical": true,
      "pass": true,
      "detail": "yoy=3.74 prev=3.40"
    },
    {
      "name": "engine_ok",
      "critical": true,
      "pass": true,
      "detail": "engine and writers completed"
    },
    {
      "name": "nowcast_ok",
      "critical": false,
      "pass": true,
      "detail": "nowcast completed"
    },
    {
      "name": "outlook_ok",
      "critical": false,
      "pass": true,
      "detail": "12-month outlook completed"
    },
    {
      "name": "composites_ok",
      "critical": false,
      "pass": true,
      "detail": "composites completed"
    },
    {
      "name": "datacenter_ok",
      "critical": false,
      "pass": true,
      "detail": "datacenter completed"
    },
    {
      "name": "geography_ok",
      "critical": false,
      "pass": true,
      "detail": "geography panel completed"
    },
    {
      "name": "labor_ok",
      "critical": false,
      "pass": true,
      "detail": "labor panel completed"
    },
    {
      "name": "commodities_ok",
      "critical": false,
      "pass": true,
      "detail": "commodities grid completed"
    },
    {
      "name": "capacity_ok",
      "critical": false,
      "pass": true,
      "detail": "capacity tracker completed"
    },
    {
      "name": "markets_ok",
      "critical": false,
      "pass": true,
      "detail": "DC market panel completed"
    },
    {
      "name": "grades_ok",
      "critical": false,
      "pass": true,
      "detail": "escalation grading harness completed"
    },
    {
      "name": "longlead_ok",
      "critical": false,
      "pass": true,
      "detail": "long-lead board completed"
    },
    {
      "name": "rates_ok",
      "critical": false,
      "pass": true,
      "detail": "rates panel completed"
    },
    {
      "name": "compute_ok",
      "critical": false,
      "pass": true,
      "detail": "compute price index completed"
    },
    {
      "name": "housing_ok",
      "critical": false,
      "pass": true,
      "detail": "housing panel completed"
    },
    {
      "name": "changes_ok",
      "critical": false,
      "pass": true,
      "detail": "since-yesterday diff completed"
    },
    {
      "name": "revisions_ok",
      "critical": false,
      "pass": true,
      "detail": "revisions panel completed"
    },
    {
      "name": "news_ok",
      "critical": false,
      "pass": true,
      "detail": "news tape completed"
    },
    {
      "name": "ledger_ok",
      "critical": false,
      "pass": true,
      "detail": "publish ledger completed"
    },
    {
      "name": "single_run_stamp",
      "critical": false,
      "pass": true,
      "detail": "all artifacts share this run's published_at"
    },
    {
      "name": "calendar_horizon",
      "critical": false,
      "pass": true,
      "detail": "CPI calendar runs 56d ahead (floor 45d)"
    },
    {
      "name": "connectors_ok",
      "critical": false,
      "pass": true,
      "detail": "43/43 ok"
    },
    {
      "name": "sources_fresh",
      "critical": false,
      "pass": true,
      "detail": "849/849 fresh (21 under an expected-absence policy, judged separately)"
    },
    {
      "name": "expected_absence",
      "critical": false,
      "pass": true,
      "detail": "21 series under an expected-absence policy (3 discontinued, 5 intermittent, 13 suppressed) \u2014 APU0000702212 [discontinued, 167d, review_by 2027-01-15], APU0000704211 [discontinued, 167d, review_by 2027-01-15], APU0000711311 [intermittent, 44d], APU0000713111 [intermittent, 106d, review_by 2027-01-15], vast_h200 [intermittent, 0d, review_by 2027-03-31], vast_b200 [intermittent, 3d, review_by 2027-03-31], vast_b300 [intermittent, 15d, review_by 2027-03-31], sfc_h100 [discontinued, 21d, review_by 2027-03-31], qcew_wage23_de [suppressed, 379d, review_by 2027-03-31], qcew_wage23_ks [suppressed, 379d, review_by 2027-03-31], qcew_wage23_nc [suppressed, 379d, review_by 2027-03-31], qcew_wage23_pa [suppressed, 379d, review_by 2027-03-31], qcew_wage23_c41067 [suppressed, 562d, review_by 2027-03-31], qcew_emp23_c41067 [suppressed, 562d, review_by 2027-03-31], qcew_aemp23_c41067 [suppressed, 562d, review_by 2027-03-31], qcew_wage238212_c22083 [suppressed, 379d, review_by 2027-03-31], qcew_emp238212_c22083 [suppressed, 379d, review_by 2027-03-31], qcew_aemp238212_c22083 [suppressed, 379d, review_by 2027-03-31], qcew_wage238212_c19049 [suppressed, 379d, review_by 2027-03-31], qcew_emp238212_c19049 [suppressed, 379d, review_by 2027-03-31], qcew_aemp238212_c19049 [suppressed, 379d, review_by 2027-03-31]"
    },
    {
      "name": "fuel_sources_agree",
      "critical": false,
      "pass": true,
      "detail": "AAA avg over 7 obs $4.352 vs EIA weekly $4.331 \u2014 relative divergence 0.5% (limit 7.5%; some gap is expected by design \u2014 different survey methods)"
    },
    {
      "name": "quilt_complete",
      "critical": false,
      "pass": true,
      "detail": "quilt covers 106 months (floor 24)"
    },
    {
      "name": "grocery_items",
      "critical": false,
      "pass": true,
      "detail": "grocery basket has 28 items, 0 skipped (floor 20)"
    },
    {
      "name": "nowcast_fresh",
      "critical": false,
      "pass": true,
      "detail": "CPI nowcast as-of 2026-10-15"
    },
    {
      "name": "ensemble_computed",
      "critical": false,
      "pass": true,
      "detail": "ensemble=0.31 weights: macrogauge 33%, cleveland 33%, kalshi 33%"
    },
    {
      "name": "gauge_current",
      "critical": true,
      "pass": true,
      "detail": "gauge as-of 2026-10-15 is 0d old (limit 7)"
    },
    {
      "name": "gauge_components_present",
      "critical": true,
      "pass": true,
      "detail": "all components present at grid end"
    },
    {
      "name": "basket_weights_sum",
      "critical": true,
      "pass": true,
      "detail": "sum(weights) = 1.0000"
    },
    {
      "name": "gauge_coverage",
      "critical": false,
      "pass": true,
      "detail": "gauge live coverage 39.1% (floor 35: shelter + fuel + used cars; EIA utilities count only while they extend past the BLS print)"
    },
    {
      "name": "tracker_corr",
      "critical": false,
      "pass": true,
      "detail": "tracker monthly-YoY corr vs official = 0.998 (floor 0.95)"
    }
  ]
}
